{
  "id": "cs_01M4AAVRNPC6RZRNC4TXE28PZA",
  "schema": "gamecore.studio.changeset/1",
  "intent": {
    "text": "Saltmarsh: presentation (procedural placeholder content)",
    "origin": "manual"
  },
  "operations": [
    {
      "opId": "author-presentation",
      "tool": "saltmarsh.author",
      "args": {
        "phase": "presentation"
      },
      "preconditions": "none"
    }
  ],
  "state": "Applied",
  "outcomes": [
    {
      "opId": "author-presentation",
      "status": "Applied",
      "detail": "Created paths: "
    }
  ],
  "timestamps": {
    "requested": "2026-10-07T04:45:02.520Z",
    "applied": "2026-10-07T04:45:02.530Z"
  }
}
