{
  "artifacts": [
    {
      "bytes": 32839,
      "mediaType": "application/gzip",
      "name": "package.tgz",
      "role": "package",
      "sha256": "10d9bb703386cf050596dab6e62610ae68161cc43c3ac391c75136d341f4b4ec"
    },
    {
      "bytes": 917,
      "mediaType": "application/json",
      "name": "proposal.json",
      "role": "proposal",
      "sha256": "ecda0696a036f51e3c2cabeae984129df5991ed84d7a7ec20aa09756708c8e94"
    }
  ],
  "id": "cs_01M499W15F25SN5RMAE6CVHHKD",
  "intent": {
    "origin": "agent",
    "text": "Add a pressure plate mechanism to Hollowmere: a plate that is pressed while enough actors stand on it."
  },
  "operations": [
    {
      "applyRequirement": "Compile",
      "args": {
        "description": "Pressure plate mechanism: a plate target with plate.pressed / plate.weight slots, pressed while the actors standing on it reach its threshold, refusing to go above its maximum weight or below zero; plate.press{actor} commits PlatePressed / PlateReleased.",
        "package": {
          "artifact": "sha256:10d9bb703386cf050596dab6e62610ae68161cc43c3ac391c75136d341f4b4ec"
        },
        "proposal": {
          "artifact": "sha256:ecda0696a036f51e3c2cabeae984129df5991ed84d7a7ec20aa09756708c8e94"
        },
        "stageInputs": []
      },
      "opId": "op1",
      "tool": "mechanism.propose"
    }
  ],
  "requirements": {
    "build": false,
    "compile": true,
    "max": "Compile",
    "worldRebuild": false
  },
  "schema": "gamecore.studio.changeset/1",
  "state": "Candidate"
}
