{"id":"cs_01M4AD58V954BYTMJZDAW3K1QP","schema":"gamecore.studio.changeset/1","intent":{"text":"Change the HUD objective label and bind it to the current quest stage name.","origin":"agent"},"selection":{"id":"sel_01M4AD58TBBHHT9S2ZDPT79BK4","mode":"Edit","targets":[{"kind":"Definition","authoringId":"fec46a1a-6c42-4e2d-9617-ac365d913658","global":"GlobalObjectId_V1-3-42910ef6c7c4d13f5a85ccbb2ef3b3f6-11400000-0","assetGuid":"42910ef6c7c4d13f5a85ccbb2ef3b3f6","path":"Assets/Hollowmere/UI/Definitions/Doc_Hud.asset","stamp":"sha256:155388a74029e9484192c4a5196a02efc5f7bd7962bf0504df2ca18e709f762b"}],"indexRevision":145},"baseVersions":[{"ref":{"kind":"Definition","authoringId":"fec46a1a-6c42-4e2d-9617-ac365d913658","global":"GlobalObjectId_V1-3-42910ef6c7c4d13f5a85ccbb2ef3b3f6-11400000-0","assetGuid":"42910ef6c7c4d13f5a85ccbb2ef3b3f6","path":"Assets/Hollowmere/UI/Definitions/Doc_Hud.asset","scope":"Definition","stamp":"sha256:155388a74029e9484192c4a5196a02efc5f7bd7962bf0504df2ca18e709f762b"},"stamp":"sha256:155388a74029e9484192c4a5196a02efc5f7bd7962bf0504df2ca18e709f762b"}],"operations":[{"opId":"bind-objective-stage-title","tool":"ui.bind","target":{"kind":"Definition","authoringId":"fec46a1a-6c42-4e2d-9617-ac365d913658","global":"GlobalObjectId_V1-3-42910ef6c7c4d13f5a85ccbb2ef3b3f6-11400000-0","assetGuid":"42910ef6c7c4d13f5a85ccbb2ef3b3f6","path":"Assets/Hollowmere/UI/Definitions/Doc_Hud.asset","scope":"Definition","stamp":"sha256:155388a74029e9484192c4a5196a02efc5f7bd7962bf0504df2ca18e709f762b"},"args":{"element":"objective-line","property":"text","source":"vm:hud.QuestStageTitle"},"dependsOn":[],"preconditions":"stamp","applyRequirement":"Live"}],"artifacts":[],"requirements":{"max":"Live","worldRebuild":false,"compile":false,"build":false},"links":{"etosTasks":["t6b1c05a587f7b655563d1dc4"]}}
