{
  "id": "cs_01M45GB0GYSE7CGV59A38P94V4",
  "schema": "gamecore.studio.changeset/1",
  "intent": {
    "text": "Saltmarsh: narrative (procedural placeholder content)",
    "origin": "manual"
  },
  "operations": [
    {
      "opId": "author-narrative",
      "tool": "saltmarsh.author",
      "args": {
        "phase": "narrative"
      },
      "preconditions": "none"
    }
  ],
  "state": "Applied",
  "outcomes": [
    {
      "opId": "author-narrative",
      "status": "Applied",
      "detail": "Created paths: "
    }
  ],
  "timestamps": {
    "requested": "2026-10-05T07:44:32.799Z",
    "applied": "2026-10-05T07:44:32.831Z"
  }
}
