{
  "id": "cs_01M4ANAM7Y4TEFGMJK5SVCEAPG",
  "schema": "gamecore.studio.changeset/1",
  "intent": {
    "text": "Add a bistable lever whose position latches until the next bounded toggle.",
    "origin": "agent"
  },
  "operations": [
    {
      "opId": "op1",
      "tool": "mechanism.admit",
      "args": {
        "package": {
          "artifact": "sha256:96fc3e24ccdb6bcb84b45d7f09f78c20d21680a1d81208a7119947dbee5dbd15"
        },
        "proposal": {
          "artifact": "sha256:5d8863cfd99e676222d8ede1b6912b1f54e2d357f805736c03ecee9a12878336"
        },
        "verdict": {
          "artifact": "sha256:b09141859826b4a062c5a3fdaf5d0fe2c8642987c60bc2d62de5e7c6159411ab"
        }
      },
      "applyRequirement": "Compile"
    }
  ],
  "artifacts": [
    {
      "sha256": "96fc3e24ccdb6bcb84b45d7f09f78c20d21680a1d81208a7119947dbee5dbd15",
      "name": "package.tgz",
      "mediaType": "application/gzip",
      "bytes": 16680,
      "role": "package"
    },
    {
      "sha256": "5d8863cfd99e676222d8ede1b6912b1f54e2d357f805736c03ecee9a12878336",
      "name": "proposal.json",
      "mediaType": "application/json",
      "bytes": 622,
      "role": "proposal"
    },
    {
      "sha256": "b09141859826b4a062c5a3fdaf5d0fe2c8642987c60bc2d62de5e7c6159411ab",
      "name": "verdict.json",
      "mediaType": "application/vnd.gamecore.stage-verdict+json",
      "bytes": 9415,
      "role": "verdict"
    }
  ],
  "validation": [
    {
      "scenario": "stage.admission",
      "status": "pass",
      "detail": "verified; confinement=docker; coldCache=False"
    },
    {
      "scenario": "stage.verdict",
      "status": "pass",
      "detail": "pass verdict b09141859826 slot cs-01m4anam7y4tefgmjk5svceapg (87710 ms); sha256:b09141859826b4a062c5a3fdaf5d0fe2c8642987c60bc2d62de5e7c6159411ab"
    },
    {
      "scenario": "stage.undo",
      "status": "pass",
      "detail": "verified removal"
    }
  ],
  "requirements": {
    "max": "Compile",
    "worldRebuild": false,
    "compile": true,
    "build": false
  },
  "state": "Undone",
  "timestamps": {
    "applied": "2026-10-07T07:51:51.911Z"
  }
}
