{
  "id": "cs_01M4C9NM50TKJYSBMAR10XH6XG",
  "schema": "gamecore.studio.changeset/1",
  "intent": {
    "text": "Saltmarsh: boot (procedural placeholder content)",
    "origin": "manual"
  },
  "operations": [
    {
      "opId": "author-boot",
      "tool": "saltmarsh.author",
      "args": {
        "phase": "boot"
      },
      "preconditions": "none"
    }
  ],
  "state": "Applied",
  "outcomes": [
    {
      "opId": "author-boot",
      "status": "Applied",
      "detail": "Created paths: "
    }
  ],
  "timestamps": {
    "requested": "2026-10-07T23:02:41.570Z",
    "applied": "2026-10-07T23:02:41.581Z"
  }
}
