{"id":"cs_01M481CSY34W3RQFGZG8F9TZES","schema":"gamecore.studio.changeset/1","intent":{"text":"Move Maren two metres north and make her patrol around the well.","origin":"agent"},"selection":{"id":"sel_01M481CSXDZ1AB5Y3QGDEQ2V9V","mode":"Edit","targets":[{"kind":"Entity","authoringId":"da525107-c2c1-4626-ac08-5058a1e01c06","global":"GlobalObjectId_V1-2-6cba302899c45bb919b097ade959283c-1121024804-0","assetGuid":"6cba302899c45bb919b097ade959283c","path":"Assets/Hollowmere/Regions/ThornwickVillage.unity#/Maren","stamp":"sha256:0de9c3da366974639b51cfbf09b9082c213c5a37fb7ccc1a6b3bde296aaee7ea"},{"kind":"Entity","authoringId":"e3baad87-1923-4823-82fe-69c3cc399bf4","global":"GlobalObjectId_V1-2-6cba302899c45bb919b097ade959283c-480431702-0","assetGuid":"6cba302899c45bb919b097ade959283c","path":"Assets/Hollowmere/Regions/ThornwickVillage.unity#/Village Well","stamp":"sha256:87a59125d1a36edd07a455ecf7dbe84f417d4f4dd046d4159f2369b48d3605a0"},{"kind":"Definition","authoringId":"b2252b06-3508-485b-abe4-9506dc0639a2","global":"GlobalObjectId_V1-3-cbf0b51cebb9c3db49d49f29b2615d0f-11400000-0","assetGuid":"cbf0b51cebb9c3db49d49f29b2615d0f","path":"Assets/Hollowmere/Npcs/Definitions/Maren.asset","stamp":"sha256:5a601ec2ac991904e34bfda5bfa8b173300341b2c265054b69c03116921d933a"}],"indexRevision":1},"baseVersions":[{"ref":{"kind":"Entity","authoringId":"da525107-c2c1-4626-ac08-5058a1e01c06","global":"GlobalObjectId_V1-2-6cba302899c45bb919b097ade959283c-1121024804-0","assetGuid":"6cba302899c45bb919b097ade959283c","path":"Assets/Hollowmere/Regions/ThornwickVillage.unity#/Maren","stamp":"sha256:0de9c3da366974639b51cfbf09b9082c213c5a37fb7ccc1a6b3bde296aaee7ea"},"stamp":"sha256:0de9c3da366974639b51cfbf09b9082c213c5a37fb7ccc1a6b3bde296aaee7ea"},{"ref":{"kind":"Definition","authoringId":"b2252b06-3508-485b-abe4-9506dc0639a2","global":"GlobalObjectId_V1-3-cbf0b51cebb9c3db49d49f29b2615d0f-11400000-0","assetGuid":"cbf0b51cebb9c3db49d49f29b2615d0f","path":"Assets/Hollowmere/Npcs/Definitions/Maren.asset","stamp":"sha256:5a601ec2ac991904e34bfda5bfa8b173300341b2c265054b69c03116921d933a"},"stamp":"sha256:5a601ec2ac991904e34bfda5bfa8b173300341b2c265054b69c03116921d933a"}],"operations":[{"opId":"op1","tool":"move","target":{"kind":"Entity","authoringId":"da525107-c2c1-4626-ac08-5058a1e01c06","global":"GlobalObjectId_V1-2-6cba302899c45bb919b097ade959283c-1121024804-0","assetGuid":"6cba302899c45bb919b097ade959283c","path":"Assets/Hollowmere/Regions/ThornwickVillage.unity#/Maren","scope":"Instance","stamp":"sha256:0de9c3da366974639b51cfbf09b9082c213c5a37fb7ccc1a6b3bde296aaee7ea"},"args":{"position":[-8.0,0.0,-6.0]},"dependsOn":[],"preconditions":"stamp","applyRequirement":"Rebuild"},{"opId":"op2","tool":"npc.setPatrol","target":{"kind":"Definition","authoringId":"b2252b06-3508-485b-abe4-9506dc0639a2","global":"GlobalObjectId_V1-3-cbf0b51cebb9c3db49d49f29b2615d0f-11400000-0","assetGuid":"cbf0b51cebb9c3db49d49f29b2615d0f","path":"Assets/Hollowmere/Npcs/Definitions/Maren.asset","scope":"Definition","stamp":"sha256:5a601ec2ac991904e34bfda5bfa8b173300341b2c265054b69c03116921d933a"},"args":{"points":[[-3.0,0.0,-1.9],[0.0,0.0,1.1],[3.0,0.0,-1.9],[0.0,0.0,-4.9]]},"dependsOn":["op1"],"preconditions":"stamp","applyRequirement":"Rebuild"}],"artifacts":[],"requirements":{"max":"Rebuild","worldRebuild":true,"compile":false,"build":false},"links":{"etosTasks":["t628a530fe4ae0501eb3e0d58"]},"state":"Applied","outcomes":[{"opId":"op1","status":"Applied","undo":{"inverse":{"operations":[{"opId":"inverse","tool":"move","target":{"kind":"Entity","authoringId":"da525107-c2c1-4626-ac08-5058a1e01c06","global":"GlobalObjectId_V1-2-6cba302899c45bb919b097ade959283c-1121024804-0","assetGuid":"6cba302899c45bb919b097ade959283c","path":"Assets/Hollowmere/Regions/ThornwickVillage.unity#/Maren"},"args":{"position":[-8.0,0.0,-8.0]},"preconditions":"none"}],"after":[{"ref":{"kind":"Entity","authoringId":"da525107-c2c1-4626-ac08-5058a1e01c06","global":"GlobalObjectId_V1-2-6cba302899c45bb919b097ade959283c-1121024804-0","assetGuid":"6cba302899c45bb919b097ade959283c","path":"Assets/Hollowmere/Regions/ThornwickVillage.unity#/Maren"},"stamp":"sha256:a3d12b8c2a04805852aae7fbad7c460421f0bb0c17182a1b3fbed77f961dd801"}]}}},{"opId":"op2","status":"Applied","undo":{"inverse":{"operations":[],"after":[{"ref":{"kind":"Definition","authoringId":"dabf28ee-6c4f-4ca2-9793-9d2f2b9817e5","global":"GlobalObjectId_V1-3-bc2ff8f1451bf7e67980eed38b3d4eae-11400000-0","assetGuid":"bc2ff8f1451bf7e67980eed38b3d4eae","path":"Assets/Hollowmere/Npcs/Definitions/MarenBehaviour.asset"},"stamp":"sha256:31fec7abe81ce46d3dc211f2135b87011bc7aee14dffd5ff519d14b764bc1b8c"},{"ref":{"kind":"Definition","authoringId":"b2252b06-3508-485b-abe4-9506dc0639a2","global":"GlobalObjectId_V1-3-cbf0b51cebb9c3db49d49f29b2615d0f-11400000-0","assetGuid":"cbf0b51cebb9c3db49d49f29b2615d0f","path":"Assets/Hollowmere/Npcs/Definitions/Maren.asset"},"stamp":"sha256:5a601ec2ac991904e34bfda5bfa8b173300341b2c265054b69c03116921d933a"}]}}}],"timestamps":{"requested":"2026-10-06T07:22:29.69Z","applied":"2026-10-06T07:22:29.74Z"}}
