{
  "id": "cs_01M4CBAG72R3S40DEQ56SRCS57",
  "schema": "gamecore.studio.changeset/1",
  "intent": {
    "text": "P4.2 real Editor death rollback",
    "origin": "manual"
  },
  "operations": [
    {
      "opId": "op1",
      "tool": "asset.import",
      "args": {
        "path": "Assets/Hollowmere/Tests/P4_2/Fixture/data.txt",
        "artifact": {
          "artifact": "sha256:95713e9cbdd1dfcb2d4080c2537f418d43ca0da25f0d7d6631f4f7c97b89dc47"
        }
      }
    },
    {
      "opId": "op2",
      "tool": "asset.import",
      "args": {
        "path": "Assets/Hollowmere/Tests/P4_2/Fixture/second.txt",
        "artifact": {
          "artifact": "sha256:95713e9cbdd1dfcb2d4080c2537f418d43ca0da25f0d7d6631f4f7c97b89dc47"
        }
      }
    }
  ],
  "artifacts": [
    {
      "sha256": "95713e9cbdd1dfcb2d4080c2537f418d43ca0da25f0d7d6631f4f7c97b89dc47",
      "name": "data.txt",
      "mediaType": "text/plain",
      "bytes": 11
    }
  ],
  "state": "Interrupted",
  "outcomes": [
    {
      "opId": "op1",
      "status": "Applied",
      "detail": "Prepared; completion unknown.",
      "undo": {
        "inverse": {
          "operations": [
            {
              "opId": "inverse",
              "tool": "history.restoreAsset",
              "args": {
                "path": "Assets/Hollowmere/Tests/P4_2/Fixture/data.txt",
                "artifact": {
                  "artifact": "sha256:0682c5f2076f099c34cfdd15a9e063849ed437a49677e6fcc5b4198c76575be5"
                },
                "meta": {
                  "artifact": "sha256:ea926850622bbd4dcd282fdf48a495fcbfe527b28f7a208721b058f9a6cd2991"
                }
              },
              "preconditions": "none"
            }
          ],
          "assetLevel": true
        }
      }
    }
  ],
  "timestamps": {
    "requested": "2026-10-07T23:31:34.672Z"
  }
}
