{"id":"cs_01M48G40G60NM77MGGVKH714HV","schema":"gamecore.studio.changeset/1","intent":{"text":"Add a ferryman NPC here who talks about the bell.","origin":"agent"},"selection":{"id":"sel_01M48G40FKY8GAWP9GTZGRDJ40","mode":"Edit","targets":[{"kind":"Definition","authoringId":"1ba7716b-d38c-4db3-9c0e-2a06f43c3716","global":"GlobalObjectId_V1-3-25f002ae09ef0ad13a564e056685a8ce-11400000-0","assetGuid":"25f002ae09ef0ad13a564e056685a8ce","path":"Assets/Hollowmere/Npcs/Definitions/Odd.asset","stamp":"sha256:634b0550b377f1530e4a6d6fc57d99e6cd9d38fef9d647bbf71db8778f4e3bde"},{"kind":"Location","location":{"region":"thornwickvillage","position":[4.0,0.083,1.1],"normal":[0.0,1.0,0.0]}}],"indexRevision":9},"baseVersions":[{"ref":{"kind":"Definition","authoringId":"1ba7716b-d38c-4db3-9c0e-2a06f43c3716","global":"GlobalObjectId_V1-3-25f002ae09ef0ad13a564e056685a8ce-11400000-0","assetGuid":"25f002ae09ef0ad13a564e056685a8ce","path":"Assets/Hollowmere/Npcs/Definitions/Odd.asset","stamp":"sha256:634b0550b377f1530e4a6d6fc57d99e6cd9d38fef9d647bbf71db8778f4e3bde"},"stamp":"sha256:634b0550b377f1530e4a6d6fc57d99e6cd9d38fef9d647bbf71db8778f4e3bde"},{"ref":{"kind":"Definition","authoringId":"aa779457-076d-496c-84b5-72019a826681","global":"GlobalObjectId_V1-3-b2bacaee2c3034819a57dae4f343b3ee-11400000-0","assetGuid":"b2bacaee2c3034819a57dae4f343b3ee","path":"Assets/Hollowmere/Dialogue/Graphs/Odd.asset","scope":"Definition","stamp":"sha256:7109950a3db1bf17eedade058d30f1818a77701528b168bd5cd0556e0e4d07e1"},"stamp":"sha256:7109950a3db1bf17eedade058d30f1818a77701528b168bd5cd0556e0e4d07e1"}],"operations":[{"opId":"op1","tool":"npc.addAt","target":{"kind":"Definition","authoringId":"1ba7716b-d38c-4db3-9c0e-2a06f43c3716","global":"GlobalObjectId_V1-3-25f002ae09ef0ad13a564e056685a8ce-11400000-0","assetGuid":"25f002ae09ef0ad13a564e056685a8ce","path":"Assets/Hollowmere/Npcs/Definitions/Odd.asset","scope":"Definition","stamp":"sha256:634b0550b377f1530e4a6d6fc57d99e6cd9d38fef9d647bbf71db8778f4e3bde"},"args":{"location":[4.0,0.083,1.1],"name":"Odd, ferryman"},"dependsOn":[],"preconditions":"stamp","applyRequirement":"Rebuild"},{"opId":"op2","tool":"dialogue.addLine","target":{"kind":"Definition","authoringId":"aa779457-076d-496c-84b5-72019a826681","global":"GlobalObjectId_V1-3-b2bacaee2c3034819a57dae4f343b3ee-11400000-0","assetGuid":"b2bacaee2c3034819a57dae4f343b3ee","path":"Assets/Hollowmere/Dialogue/Graphs/Odd.asset","scope":"Definition","stamp":"sha256:7109950a3db1bf17eedade058d30f1818a77701528b168bd5cd0556e0e4d07e1"},"args":{"after":0,"text":"Hear that silence? The bell in the drowned belfry used to carry clear across this water. Now even the river waits for it to ring again."},"dependsOn":[],"preconditions":"stamp","applyRequirement":"Rebuild"},{"opId":"op3","tool":"set","target":{"kind":"Definition","authoringId":"aa779457-076d-496c-84b5-72019a826681","global":"GlobalObjectId_V1-3-b2bacaee2c3034819a57dae4f343b3ee-11400000-0","assetGuid":"b2bacaee2c3034819a57dae4f343b3ee","path":"Assets/Hollowmere/Dialogue/Graphs/Odd.asset","scope":"Definition","stamp":"sha256:7109950a3db1bf17eedade058d30f1818a77701528b168bd5cd0556e0e4d07e1"},"args":{"field":"entry","value":8},"dependsOn":["op2"],"preconditions":"stamp","applyRequirement":"Live"}],"artifacts":[],"requirements":{"max":"Rebuild","worldRebuild":true,"compile":false,"build":false},"links":{"etosTasks":["t4718cefbebede6b645f6cee1"]},"state":"Applied","outcomes":[{"opId":"op1","status":"Applied","undo":{"inverse":{"operations":[{"opId":"inverse","tool":"history.deleteCreated","args":{"created":{"kind":"Entity","authoringId":"18234c75-0ba0-4a86-acb3-c0bc00ae1625"}},"preconditions":"none"}],"after":[{"ref":{"kind":"Entity","authoringId":"18234c75-0ba0-4a86-acb3-c0bc00ae1625","global":"GlobalObjectId_V1-2-6cba302899c45bb919b097ade959283c-1997517703-0","assetGuid":"6cba302899c45bb919b097ade959283c","path":"Assets/Hollowmere/Regions/ThornwickVillage.unity#/Odd, ferryman"},"stamp":"sha256:836f1ace106539d155f3d100765daac70de122b868942825fcd21eae6726ddca"}],"replay":{"authoringId":"18234c75-0ba0-4a86-acb3-c0bc00ae1625"}}}},{"opId":"op2","status":"Applied","undo":{"inverse":{"operations":[{"opId":"inverse","tool":"set","target":{"kind":"Definition","authoringId":"aa779457-076d-496c-84b5-72019a826681","global":"GlobalObjectId_V1-3-b2bacaee2c3034819a57dae4f343b3ee-11400000-0","assetGuid":"b2bacaee2c3034819a57dae4f343b3ee","path":"Assets/Hollowmere/Dialogue/Graphs/Odd.asset"},"args":{"fields":{"nodes":[{"kind":"Branch","speaker":"","speakerEntityId":"","text":"","voiceClip":null,"portrait":null,"condition":{"kind":"Definition","authoringId":"a6f7c2a5-47b1-4fe9-a6fb-a5946f443f67","global":"GlobalObjectId_V1-3-5dc4b5ce6affc78bc94dd2031bc52e2d-11400000-0","assetGuid":"5dc4b5ce6affc78bc94dd2031bc52e2d","path":"Assets/Hollowmere/Rules/Conditions/OddFavour.asset"},"actions":null,"options":[]},{"kind":"Branch","speaker":"","speakerEntityId":"","text":"","voiceClip":null,"portrait":null,"condition":{"kind":"Definition","authoringId":"28e34721-a716-4890-a863-fb0cfba9df30","global":"GlobalObjectId_V1-3-850520e0be842c7e9830bf255c4a9069-11400000-0","assetGuid":"850520e0be842c7e9830bf255c4a9069","path":"Assets/Hollowmere/Rules/Conditions/ShrineLit.asset"},"actions":null,"options":[]},{"kind":"Line","speaker":"","speakerEntityId":"","text":"The belfry? I ferry no strangers over that water. Light the sunken shrine, west to east, and we will talk. Or patch the old punt yourself; it wants pitch from an oil flask.","voiceClip":{"kind":"Asset","global":"GlobalObjectId_V1-1-5fdc82ba185d091d09bf83838a024617-8300000-0","assetGuid":"5fdc82ba185d091d09bf83838a024617","path":"Assets/Hollowmere/Media/Voices/Odd_refuse.wav"},"portrait":null,"condition":null,"actions":null,"options":[]},{"kind":"Line","speaker":"","speakerEntityId":"","text":"You lit the old shrine. My mother tended it. I owe you a crossing.","voiceClip":{"kind":"Asset","global":"GlobalObjectId_V1-1-b4ca9038e0c69834695bc1d46b2921b2-8300000-0","assetGuid":"b4ca9038e0c69834695bc1d46b2921b2","path":"Assets/Hollowmere/Media/Voices/Odd_thanks.wav"},"portrait":null,"condition":null,"actions":null,"options":[]},{"kind":"Action","speaker":"","speakerEntityId":"","text":"","voiceClip":null,"portrait":null,"condition":null,"actions":{"kind":"Definition","authoringId":"d2a1a116-34a6-4f16-bd03-7575628b11d9","global":"GlobalObjectId_V1-3-e952c26493555ce73964aef5c959145a-11400000-0","assetGuid":"e952c26493555ce73964aef5c959145a","path":"Assets/Hollowmere/Rules/Actions/OddGrantsFavour.asset"},"options":[]},{"kind":"Choice","speaker":"","speakerEntityId":"","text":"The black water is calm tonight.","voiceClip":null,"portrait":null,"condition":null,"actions":null,"options":[{"text":"Take me to the belfry.","condition":{"kind":"Definition","authoringId":"78eeeedd-9917-460a-8d0e-71d128dc7246","global":"GlobalObjectId_V1-3-abc1982dda435320caeb533fec290a89-11400000-0","assetGuid":"abc1982dda435320caeb533fec290a89","path":"Assets/Hollowmere/Rules/Conditions/HasLantern.asset"},"hideWhenUnavailable":false},{"text":"Not yet.","condition":null,"hideWhenUnavailable":false}]},{"kind":"Action","speaker":"","speakerEntityId":"","text":"","voiceClip":null,"portrait":null,"condition":null,"actions":{"kind":"Definition","authoringId":"421c017e-2867-4d58-821a-67045e416c1b","global":"GlobalObjectId_V1-3-a352f18a1dcae618b83742479b4bbcc5-11400000-0","assetGuid":"a352f18a1dcae618b83742479b4bbcc5","path":"Assets/Hollowmere/Rules/Actions/FerryCrossing.asset"},"options":[]},{"kind":"Line","speaker":"","speakerEntityId":"","text":"I will be here. The water is patient.","voiceClip":{"kind":"Asset","global":"GlobalObjectId_V1-1-7650ef440c5863f3f8658e8e77831ae2-8300000-0","assetGuid":"7650ef440c5863f3f8658e8e77831ae2","path":"Assets/Hollowmere/Media/Voices/Odd_wait.wav"},"portrait":null,"condition":null,"actions":null,"options":[]}],"edges":[{"from":0,"port":"Else","option":0,"to":1},{"from":1,"port":"Else","option":0,"to":2},{"from":1,"port":"Next","option":0,"to":3},{"from":3,"port":"Next","option":0,"to":4},{"from":4,"port":"Next","option":0,"to":5},{"from":0,"port":"Next","option":0,"to":5},{"from":5,"port":"Option","option":0,"to":6},{"from":5,"port":"Option","option":1,"to":7}]}},"preconditions":"none"}],"after":[{"ref":{"kind":"Definition","authoringId":"aa779457-076d-496c-84b5-72019a826681","global":"GlobalObjectId_V1-3-b2bacaee2c3034819a57dae4f343b3ee-11400000-0","assetGuid":"b2bacaee2c3034819a57dae4f343b3ee","path":"Assets/Hollowmere/Dialogue/Graphs/Odd.asset"},"stamp":"sha256:d4e8beb0d5a29781e54686cd9cd23849fd4874e7961af36d91bcfb38a444fab7"}]}}},{"opId":"op3","status":"Applied","undo":{"inverse":{"operations":[{"opId":"inverse","tool":"set","target":{"kind":"Definition","authoringId":"aa779457-076d-496c-84b5-72019a826681","global":"GlobalObjectId_V1-3-b2bacaee2c3034819a57dae4f343b3ee-11400000-0","assetGuid":"b2bacaee2c3034819a57dae4f343b3ee","path":"Assets/Hollowmere/Dialogue/Graphs/Odd.asset"},"args":{"fields":{"entry":0}},"preconditions":"none"}],"after":[{"ref":{"kind":"Definition","authoringId":"aa779457-076d-496c-84b5-72019a826681","global":"GlobalObjectId_V1-3-b2bacaee2c3034819a57dae4f343b3ee-11400000-0","assetGuid":"b2bacaee2c3034819a57dae4f343b3ee","path":"Assets/Hollowmere/Dialogue/Graphs/Odd.asset"},"stamp":"sha256:d4e8beb0d5a29781e54686cd9cd23849fd4874e7961af36d91bcfb38a444fab7"}]}}}],"timestamps":{"requested":"2026-10-06T11:40:01.616Z","applied":"2026-10-06T11:40:01.668Z"}}
